{
  "schema_version": "1.0",
  "profile_id": "full-potential",
  "version": "1.0",
  "evaluation_mode": "FULL_POTENTIAL",
  "weights": { "user_value": 0.30, "product_capability": 0.30, "investment_potential": 0.30, "evidence_quality": 0.10 },
  "thresholds": { "PROCEED": 80, "VALIDATE_FURTHER": 60, "ADJUST": 40 },
  "required_agents": ["user-evidence", "product-engineering", "business-investment"],
  "coverage_rules": { "proceed_minimum": 0.70, "scoring_minimum": 0.50, "rejected_findings_score_zero": true },
  "recommendation_caps": { "missing_optional_agent": "VALIDATE_FURTHER", "unresolved_conflict": "VALIDATE_FURTHER", "low_coverage": "VALIDATE_FURTHER" }
}
